{
  "status": "idle",
  "current_task": null,
  "history": [
    {
      "task_id": "INFRA-014-create-memory-layer-interface",
      "type": "change",
      "mode": "FULL",
      "status": "done",
      "timestamp": "2026-04-04T03:21:51Z",
      "registry_record": "registry/runs/2026-04-04T03-21-51Z_INFRA-014-create-memory-layer-interface.json",
      "task_source": "tasks/INFRA-014_create_memory_layer_interface.task.json",
      "linear_issue_id": "INFRA-014",
      "linear_project": "Memory Layer",
      "linear_team_key": "INF",
      "service_target": "memory-layer",
      "approval_required": true,
      "execution_policy": "human_in_the_loop",
      "resolved_linear_issue_identifier": "INF-14",
      "context_packet": "state/runtime/INFRA-014-create-memory-layer-interface/context-packet.json",
      "memory_backend": "mock",
      "retrieved_memory_count": 3
    },
    {
      "task_id": "INFRA-016-create-context-packet-for-tasks",
      "type": "command",
      "mode": "FULL",
      "status": "done",
      "timestamp": "2026-04-04T03:21:51Z",
      "registry_record": "registry/runs/2026-04-04T03-21-51Z_INFRA-016-create-context-packet-for-tasks.json",
      "task_source": "tasks/INFRA-016_create_context_packet_for_tasks.task.json",
      "linear_issue_id": "INFRA-016",
      "linear_project": "Memory Layer",
      "linear_team_key": "INF",
      "service_target": "context-packet",
      "approval_required": true,
      "execution_policy": "local_context_generation",
      "resolved_linear_issue_identifier": "INF-16",
      "context_packet": "state/runtime/INFRA-016-create-context-packet-for-tasks/context-packet.json",
      "memory_backend": "mock",
      "retrieved_memory_count": 3
    },
    {
      "task_id": "INFRA-014-create-memory-layer-interface",
      "type": "change",
      "mode": "FULL",
      "status": "error",
      "timestamp": "2026-04-04T22:05:22Z",
      "registry_record": "registry/runs/2026-04-04T22-05-21Z_INFRA-014-create-memory-layer-interface.json",
      "task_source": "tasks/INFRA-014_create_memory_layer_interface.task.json",
      "linear_issue_id": "INFRA-014",
      "linear_project": "Memory Layer",
      "linear_team_key": "INF",
      "service_target": "memory-layer",
      "approval_required": true,
      "execution_policy": "human_in_the_loop"
    },
    {
      "task_id": "INFRA-014-create-memory-layer-interface",
      "type": "change",
      "mode": "FULL",
      "status": "done",
      "timestamp": "2026-04-04T22:06:10Z",
      "registry_record": "registry/runs/2026-04-04T22-06-08Z_INFRA-014-create-memory-layer-interface.json",
      "task_source": "tasks/INFRA-014_create_memory_layer_interface.task.json",
      "linear_issue_id": "INFRA-014",
      "linear_project": "Memory Layer",
      "linear_team_key": "INF",
      "service_target": "memory-layer",
      "approval_required": true,
      "execution_policy": "human_in_the_loop",
      "resolved_linear_issue_identifier": "INF-14",
      "context_packet": "state/runtime/INFRA-014-create-memory-layer-interface/context-packet.json",
      "memory_backend": "supabase",
      "retrieved_memory_count": 1
    }
  ],
  "version": 1
}
