{
  "status": "running",
  "current_task": {
    "task_id": "INFRA-028-tokens-p0-sessao-login-seguranca-observabilidade",
    "type": "change",
    "mode": "FULL",
    "task_source": "tasks/INFRA-028_tokens_p0_sessao_login_seguranca_observabilidade.task.json",
    "linear_issue_id": "INFRA-028",
    "linear_project": "Sprint Final",
    "linear_team_key": "INF",
    "service_target": "agent-hub",
    "approval_required": true,
    "execution_policy": "human_in_the_loop"
  },
  "history": [
    {
      "task_id": "INFRA-014-create-memory-layer-interface",
      "type": "change",
      "mode": "FULL",
      "status": "done",
      "timestamp": "2026-04-04T03:21:51Z",
      "registry_record": "registry/runs/2026-04-04T03-21-51Z_INFRA-014-create-memory-layer-interface.json",
      "task_source": "tasks/INFRA-014_create_memory_layer_interface.task.json",
      "linear_issue_id": "INFRA-014",
      "linear_project": "Memory Layer",
      "linear_team_key": "INF",
      "service_target": "memory-layer",
      "approval_required": true,
      "execution_policy": "human_in_the_loop",
      "resolved_linear_issue_identifier": "INF-14",
      "context_packet": "state/runtime/INFRA-014-create-memory-layer-interface/context-packet.json",
      "memory_backend": "mock",
      "retrieved_memory_count": 3
    },
    {
      "task_id": "INFRA-016-create-context-packet-for-tasks",
      "type": "command",
      "mode": "FULL",
      "status": "done",
      "timestamp": "2026-04-04T03:21:51Z",
      "registry_record": "registry/runs/2026-04-04T03-21-51Z_INFRA-016-create-context-packet-for-tasks.json",
      "task_source": "tasks/INFRA-016_create_context_packet_for_tasks.task.json",
      "linear_issue_id": "INFRA-016",
      "linear_project": "Memory Layer",
      "linear_team_key": "INF",
      "service_target": "context-packet",
      "approval_required": true,
      "execution_policy": "local_context_generation",
      "resolved_linear_issue_identifier": "INF-16",
      "context_packet": "state/runtime/INFRA-016-create-context-packet-for-tasks/context-packet.json",
      "memory_backend": "mock",
      "retrieved_memory_count": 3
    },
    {
      "task_id": "INFRA-014-create-memory-layer-interface",
      "type": "change",
      "mode": "FULL",
      "status": "error",
      "timestamp": "2026-04-04T22:05:22Z",
      "registry_record": "registry/runs/2026-04-04T22-05-21Z_INFRA-014-create-memory-layer-interface.json",
      "task_source": "tasks/INFRA-014_create_memory_layer_interface.task.json",
      "linear_issue_id": "INFRA-014",
      "linear_project": "Memory Layer",
      "linear_team_key": "INF",
      "service_target": "memory-layer",
      "approval_required": true,
      "execution_policy": "human_in_the_loop"
    },
    {
      "task_id": "INFRA-014-create-memory-layer-interface",
      "type": "change",
      "mode": "FULL",
      "status": "done",
      "timestamp": "2026-04-04T22:06:10Z",
      "registry_record": "registry/runs/2026-04-04T22-06-08Z_INFRA-014-create-memory-layer-interface.json",
      "task_source": "tasks/INFRA-014_create_memory_layer_interface.task.json",
      "linear_issue_id": "INFRA-014",
      "linear_project": "Memory Layer",
      "linear_team_key": "INF",
      "service_target": "memory-layer",
      "approval_required": true,
      "execution_policy": "human_in_the_loop",
      "resolved_linear_issue_identifier": "INF-14",
      "context_packet": "state/runtime/INFRA-014-create-memory-layer-interface/context-packet.json",
      "memory_backend": "supabase",
      "retrieved_memory_count": 1
    },
    {
      "task_id": "INFRA-014-create-memory-layer-interface",
      "type": "change",
      "mode": "FULL",
      "status": "done",
      "timestamp": "2026-04-06T02:12:47Z",
      "registry_record": "registry/runs/2026-04-06T02-12-44Z_INFRA-014-create-memory-layer-interface.json",
      "task_source": "tasks/INFRA-014_create_memory_layer_interface.task.json",
      "linear_issue_id": "INFRA-014",
      "linear_project": "Memory Layer",
      "linear_team_key": "INF",
      "service_target": "memory-layer",
      "approval_required": true,
      "execution_policy": "human_in_the_loop",
      "resolved_linear_issue_identifier": "INF-14",
      "context_packet": "state/runtime/INFRA-014-create-memory-layer-interface/context-packet.json",
      "memory_backend": "supabase",
      "retrieved_memory_count": 1
    },
    {
      "task_id": "hello-world",
      "type": "echo",
      "mode": "FAST",
      "status": "done",
      "timestamp": "2026-04-07T19:15:20Z",
      "registry_record": "registry/runs/2026-04-07T19-15-19Z_hello-world.json",
      "task_source": "examples/hello.task.json"
    },
    {
      "task_id": "hello-world",
      "type": "echo",
      "mode": "FAST",
      "status": "done",
      "timestamp": "2026-04-13T14:56:37Z",
      "registry_record": "registry/runs/2026-04-13T14-56-32Z_hello-world.json",
      "task_source": "examples/hello.task.json"
    },
    {
      "task_id": "INFRA-021-jarvis-p0-ansible-terraform-iac-dns",
      "type": "change",
      "mode": "FULL",
      "status": "done",
      "timestamp": "2026-04-21T14:47:27Z",
      "registry_record": "registry/runs/2026-04-21T14-47-27Z_INFRA-021-jarvis-p0-ansible-terraform-iac-dns.json",
      "task_source": "tasks/INFRA-021_jarvis_p0_ansible_terraform_iac_dns.task.json",
      "linear_project": "Bootstrap IaC",
      "linear_team_key": "INF",
      "service_target": "jarvis-control-plane",
      "approval_required": true,
      "execution_policy": "human_in_the_loop"
    }
  ],
  "version": 1
}
