{
  "status": "idle",
  "current_task": null,
  "history": [
    {
      "task_id": "INFRA-014-create-memory-layer-interface",
      "type": "change",
      "mode": "FULL",
      "status": "done",
      "timestamp": "2026-04-04T03:21:51Z",
      "registry_record": "registry/runs/2026-04-04T03-21-51Z_INFRA-014-create-memory-layer-interface.json",
      "task_source": "tasks/INFRA-014_create_memory_layer_interface.task.json",
      "linear_issue_id": "INFRA-014",
      "linear_project": "Memory Layer",
      "linear_team_key": "INF",
      "service_target": "memory-layer",
      "approval_required": true,
      "execution_policy": "human_in_the_loop",
      "resolved_linear_issue_identifier": "INF-14",
      "context_packet": "state/runtime/INFRA-014-create-memory-layer-interface/context-packet.json",
      "memory_backend": "mock",
      "retrieved_memory_count": 3
    }
  ],
  "version": 1
}
